{
 "schema_version": "0.2",
 "source": {
  "sample_id": "c6_mazak_stx510",
  "page": 76,
  "pdf_kind": "vector"
 },
 "sheet": {
  "title": "AXIS LS",
  "sheet_id": null,
  "layout": {
   "orientation": "horizontal",
   "location_system": "zone_grid",
   "lines": "01–30",
   "columns": "A–M",
   "label_placement": "行番号は左側、列記号は上側",
   "junction_rule": "黒丸は接続を示す。黒丸のない交差は非接続。"
  }
 },
 "regions": [
  {
   "id": "machine_side",
   "label": "MACHINE SIDE",
   "kind": "area",
   "meaning": "機械側スイッチ"
  },
  {
   "id": "A11",
   "label": "TU(A11)",
   "kind": "unit",
   "meaning": "端子ユニット"
  },
  {
   "id": "A1",
   "label": "NC(A1)",
   "kind": "unit",
   "meaning": "PLC入力ユニット"
  }
 ],
 "rails": [
  {
   "id": "rail:1L+",
   "name": "1L+",
   "polarity": "plus",
   "polarity_basis": {
    "value": "図中の1L+表記",
    "basis": "drawing",
    "evidence": [
     "行03、左側電源線の上に「1L+」と記載"
    ]
   },
   "pos": [
    79.62,
    104.61
   ]
  }
 ],
 "components": [
  {
   "id": "A11",
   "name": "TU",
   "kind": "terminal unit",
   "symbol": "TU(A11)",
   "region": "A11",
   "purpose": null,
   "terminals": [
    "420",
    "10",
    "7/A4",
    "16",
    "421",
    "11",
    "8/B4",
    "422",
    "8",
    "9/A5",
    "400",
    "4",
    "11/A6",
    "10",
    "401",
    "5",
    "15/A8",
    "11",
    "13",
    "358",
    "9",
    "402",
    "6",
    "12/B6",
    "403",
    "8",
    "16/B8",
    "358",
    "7",
    "404",
    "4",
    "13/A7",
    "405",
    "5",
    "17/A9",
    "37"
   ]
  },
  {
   "id": "A1",
   "name": "NC",
   "kind": "PLC input unit",
   "symbol": "NC(A1)",
   "region": "A1",
   "purpose": {
    "value": "PLC入力",
    "basis": "drawing",
    "evidence": [
     "NC(A1)枠内にX0.xxの入力アドレスとコメントが記載"
    ]
   },
   "terminals": [
    "X0.00",
    "X0.01",
    "X0.02",
    "X0.04",
    "X0.08",
    "X0.05",
    "X0.09",
    "X0.06",
    "X0.10"
   ]
  },
  {
   "id": "XT31",
   "kind": "unit",
   "terminals": [
    "420",
    "421",
    "400",
    "401",
    "358",
    "402",
    "403"
   ]
  },
  {
   "id": "X31",
   "kind": "unit",
   "terminals": [
    "10",
    "11",
    "4",
    "5",
    "9",
    "6",
    "8"
   ]
  },
  {
   "id": "XCS41",
   "kind": "unit",
   "terminals": [
    "7/A4",
    "8/B4",
    "9/A5",
    "11/A6",
    "15/A8",
    "12/B6",
    "16/B8",
    "13/A7",
    "17/A9"
   ]
  },
  {
   "id": "X51",
   "kind": "unit",
   "terminals": [
    "16",
    "10",
    "11",
    "13"
   ]
  },
  {
   "id": "XT71",
   "kind": "unit",
   "terminals": [
    "422",
    "358",
    "404",
    "405"
   ]
  },
  {
   "id": "X71",
   "kind": "unit",
   "terminals": [
    "8",
    "7",
    "4",
    "5"
   ]
  },
  {
   "id": "X85",
   "kind": "unit",
   "terminals": [
    "37"
   ]
  }
 ],
 "ports": [
  {
   "id": "XT31:420",
   "pos": [
    157.44,
    104.61
   ]
  },
  {
   "id": "X31:10",
   "pos": [
    248.91,
    104.64
   ]
  },
  {
   "id": "XCS41:7/A4",
   "pos": [
    357.84,
    104.64
   ]
  },
  {
   "id": "X51:16",
   "pos": [
    248.91,
    127.95
   ]
  },
  {
   "id": "XT31:421",
   "pos": [
    157.44,
    151.2
   ]
  },
  {
   "id": "X31:11",
   "pos": [
    248.91,
    151.23
   ]
  },
  {
   "id": "XCS41:8/B4",
   "pos": [
    357.84,
    151.23
   ]
  },
  {
   "id": "XT71:422",
   "pos": [
    157.44,
    174.51
   ]
  },
  {
   "id": "X71:8",
   "pos": [
    248.91,
    174.54
   ]
  },
  {
   "id": "XCS41:9/A5",
   "pos": [
    357.84,
    174.54
   ]
  },
  {
   "id": "XT31:400",
   "pos": [
    157.44,
    244.44
   ]
  },
  {
   "id": "X31:4",
   "pos": [
    248.91,
    244.44
   ]
  },
  {
   "id": "XCS41:11/A6",
   "pos": [
    357.84,
    244.44
   ]
  },
  {
   "id": "X51:10",
   "pos": [
    248.91,
    267.75
   ]
  },
  {
   "id": "XT31:401",
   "pos": [
    157.44,
    291.03
   ]
  },
  {
   "id": "X31:5",
   "pos": [
    248.91,
    291.06
   ]
  },
  {
   "id": "XCS41:15/A8",
   "pos": [
    357.84,
    291.06
   ]
  },
  {
   "id": "X51:11",
   "pos": [
    248.91,
    314.37
   ]
  },
  {
   "id": "X51:13",
   "pos": [
    248.91,
    337.65
   ]
  },
  {
   "id": "XT31:358",
   "pos": [
    157.44,
    360.93
   ]
  },
  {
   "id": "X31:9",
   "pos": [
    248.91,
    360.96
   ]
  },
  {
   "id": "XT31:402",
   "pos": [
    157.44,
    384.24
   ]
  },
  {
   "id": "X31:6",
   "pos": [
    248.91,
    384.27
   ]
  },
  {
   "id": "XCS41:12/B6",
   "pos": [
    357.84,
    384.27
   ]
  },
  {
   "id": "XT31:403",
   "pos": [
    157.44,
    430.83
   ]
  },
  {
   "id": "X31:8",
   "pos": [
    248.91,
    430.86
   ]
  },
  {
   "id": "XCS41:16/B8",
   "pos": [
    357.84,
    430.86
   ]
  },
  {
   "id": "XT71:358",
   "pos": [
    157.44,
    454.14
   ]
  },
  {
   "id": "X71:7",
   "pos": [
    248.91,
    454.17
   ]
  },
  {
   "id": "XT71:404",
   "pos": [
    157.44,
    477.42
   ]
  },
  {
   "id": "X71:4",
   "pos": [
    248.91,
    477.45
   ]
  },
  {
   "id": "XCS41:13/A7",
   "pos": [
    357.84,
    477.45
   ]
  },
  {
   "id": "XT71:405",
   "pos": [
    157.44,
    524.04
   ]
  },
  {
   "id": "X71:5",
   "pos": [
    248.91,
    524.07
   ]
  },
  {
   "id": "XCS41:17/A9",
   "pos": [
    357.84,
    524.07
   ]
  },
  {
   "id": "X85:37",
   "pos": [
    248.91,
    593.97
   ]
  },
  {
   "id": "A1:X0.00",
   "pos": [
    299.49,
    104.64
   ]
  },
  {
   "id": "A1:X0.01",
   "pos": [
    299.49,
    151.23
   ]
  },
  {
   "id": "A1:X0.02",
   "pos": [
    299.49,
    174.54
   ]
  },
  {
   "id": "A1:X0.04",
   "pos": [
    299.49,
    244.44
   ]
  },
  {
   "id": "A1:X0.08",
   "pos": [
    299.49,
    291.06
   ]
  },
  {
   "id": "A1:X0.05",
   "pos": [
    299.49,
    384.27
   ]
  },
  {
   "id": "A1:X0.09",
   "pos": [
    299.49,
    430.86
   ]
  },
  {
   "id": "A1:X0.06",
   "pos": [
    299.49,
    477.45
   ]
  },
  {
   "id": "A1:X0.10",
   "pos": [
    299.49,
    524.07
   ]
  }
 ],
 "junctions": [
  {
   "id": "J1",
   "pos": [
    266.37,
    104.61
   ]
  },
  {
   "id": "J2",
   "pos": [
    79.62,
    151.2
   ]
  },
  {
   "id": "J3",
   "pos": [
    79.62,
    174.51
   ]
  },
  {
   "id": "J4",
   "pos": [
    79.62,
    244.41
   ]
  },
  {
   "id": "J5",
   "pos": [
    95.19,
    244.41
   ]
  },
  {
   "id": "J6",
   "pos": [
    266.37,
    244.41
   ]
  },
  {
   "id": "J7",
   "pos": [
    141.87,
    267.72
   ]
  },
  {
   "id": "J8",
   "pos": [
    79.62,
    291.03
   ]
  },
  {
   "id": "J9",
   "pos": [
    95.19,
    291.03
   ]
  },
  {
   "id": "J10",
   "pos": [
    266.37,
    291.03
   ]
  },
  {
   "id": "J11",
   "pos": [
    141.87,
    360.93
   ]
  },
  {
   "id": "J12",
   "pos": [
    266.37,
    360.93
   ]
  },
  {
   "id": "J13",
   "pos": [
    79.62,
    384.24
   ]
  },
  {
   "id": "J14",
   "pos": [
    95.19,
    384.24
   ]
  },
  {
   "id": "J15",
   "pos": [
    79.62,
    430.83
   ]
  },
  {
   "id": "J16",
   "pos": [
    95.19,
    430.83
   ]
  },
  {
   "id": "J17",
   "pos": [
    141.87,
    454.14
   ]
  },
  {
   "id": "J18",
   "pos": [
    266.37,
    454.14
   ]
  },
  {
   "id": "J19",
   "pos": [
    79.62,
    477.42
   ]
  },
  {
   "id": "J20",
   "pos": [
    95.19,
    477.42
   ]
  },
  {
   "id": "J21",
   "pos": [
    79.62,
    524.04
   ]
  },
  {
   "id": "J22",
   "pos": [
    95.19,
    524.04
   ]
  },
  {
   "id": "J23",
   "pos": [
    365.28,
    593.88
   ]
  },
  {
   "id": "J24",
   "pos": [
    266.37,
    593.94
   ]
  },
  {
   "id": "J25",
   "pos": [
    297.51,
    593.94
   ]
  },
  {
   "id": "J26",
   "pos": [
    383.22,
    593.94
   ]
  },
  {
   "id": "J27",
   "pos": [
    406.44,
    593.94
   ]
  },
  {
   "id": "J28",
   "pos": [
    406.44,
    617.25
   ]
  }
 ],
 "wires": [
  {
   "id": "W1",
   "ends": [
    "rail:1L+",
    "J2"
   ],
   "path": [
    [
     79.62,
     104.61
    ],
    [
     79.62,
     151.2
    ]
   ]
  },
  {
   "id": "W2",
   "ends": [
    "XT31:420",
    "X31:10"
   ],
   "path": [
    [
     157.44,
     104.61
    ],
    [
     248.91,
     104.64
    ]
   ]
  },
  {
   "id": "W3",
   "ends": [
    "J1",
    "X31:10"
   ],
   "path": [
    [
     266.37,
     104.61
    ],
    [
     248.91,
     104.64
    ]
   ]
  },
  {
   "id": "W4",
   "ends": [
    "J1",
    "A1:X0.00"
   ],
   "path": [
    [
     266.37,
     104.61
    ],
    [
     299.49,
     104.64
    ]
   ]
  },
  {
   "id": "W5",
   "ends": [
    "J1",
    "X51:16"
   ],
   "path": [
    [
     266.37,
     104.61
    ],
    [
     266.4,
     127.92
    ],
    [
     248.91,
     127.95
    ]
   ]
  },
  {
   "id": "W6",
   "ends": [
    "A1:X0.00",
    "XCS41:7/A4"
   ],
   "path": [
    [
     299.49,
     104.64
    ],
    [
     357.84,
     104.64
    ]
   ]
  },
  {
   "id": "W7",
   "ends": [
    "J2",
    "J3"
   ],
   "path": [
    [
     79.62,
     151.2
    ],
    [
     79.62,
     174.51
    ]
   ]
  },
  {
   "id": "W8",
   "ends": [
    "XT31:421",
    "X31:11"
   ],
   "path": [
    [
     157.44,
     151.2
    ],
    [
     248.91,
     151.23
    ]
   ]
  },
  {
   "id": "W9",
   "ends": [
    "X31:11",
    "A1:X0.01"
   ],
   "path": [
    [
     248.91,
     151.23
    ],
    [
     299.49,
     151.23
    ]
   ]
  },
  {
   "id": "W10",
   "ends": [
    "A1:X0.01",
    "XCS41:8/B4"
   ],
   "path": [
    [
     299.49,
     151.23
    ],
    [
     357.84,
     151.23
    ]
   ]
  },
  {
   "id": "W11",
   "ends": [
    "J3",
    "J4"
   ],
   "path": [
    [
     79.62,
     174.51
    ],
    [
     79.62,
     244.41
    ]
   ]
  },
  {
   "id": "W12",
   "ends": [
    "XT71:422",
    "X71:8"
   ],
   "path": [
    [
     157.44,
     174.51
    ],
    [
     248.91,
     174.54
    ]
   ]
  },
  {
   "id": "W13",
   "ends": [
    "X71:8",
    "A1:X0.02"
   ],
   "path": [
    [
     248.91,
     174.54
    ],
    [
     299.49,
     174.54
    ]
   ]
  },
  {
   "id": "W14",
   "ends": [
    "A1:X0.02",
    "XCS41:9/A5"
   ],
   "path": [
    [
     299.49,
     174.54
    ],
    [
     357.84,